<?xml version="1.0" encoding="UTF-8"?>
<tns:timeline xmlns:tns="http://www.example.org/DeMacho" xmlns:xsi="http://www.w3.org/2001/XMLSchema-instance" xsi:schemaLocation="http://www.example.org/DeMacho DeMacho.xsd ">
  <tns:usuario>
    <tns:id>0</tns:id>
    <tns:nome>tns:nome</tns:nome>
    <tns:nomeCompleto>tns:nomeCompleto</tns:nomeCompleto>
    <tns:email>tns:email</tns:email>
    <tns:dataNascimento>2001-01-01</tns:dataNascimento>
    <tns:sexo>FEMININO</tns:sexo>
    <tns:statusConta>ATIVO</tns:statusConta>
    <tns:status>ONLINE</tns:status>
    <tns:foto>MA==</tns:foto>
  </tns:usuario>
</tns:timeline>
